### ISSUE TITLE
Client returns TRILOGY_INVALID_SEQUENCE_ID 

### ISSUE THREAD

**Issue by k0i** [trilogy-libraries/trilogy#127]
I wrote codes with trilogy and async.

```ruby
client = Trilogy.new(host: "127.0.0.1", port: 3306, username: "root", password: "test")

barrier = Async::Barrier.new

Sync do |task|
  2.times.map do
    barrier.async do
      client.query("SHOW DATABASES")
    end
  end.map(&:wait)
ensure
  barrier.stop
end
```

It returns the following error.
```
❯ ruby tril_to_mysql.rb
/home/koyam/.rbenv/versions/debug/lib/ruby/gems/3.3.0+0/gems/io-event-1.3.2/lib/io/event/support.rb:24: warning: IO::Buffer is experimental and both the Ruby and C interface may change in the future!
tril_to_mysql.rb:40:in `query': trilogy_query_recv: TRILOGY_INVALID_SEQUENCE_ID (Trilogy::QueryError)
        from tril_to_mysql.rb:40:in `block (3 levels) in <main>'
        from /home/koyam/.rbenv/versions/debug/lib/ruby/gems/3.3.0+0/gems/async-2.6.4/lib/async/task.rb:160:in `block in run'
        from /home/koyam/.rbenv/versions/debug/lib/ruby/gems/3.3.0+0/gems/async-2.6.4/lib/async/task.rb:330:in `block in schedule'
```

However, it is not so surprising for me because the integration the above two gems is now under development.
(I'm watching this [pr](https://github.com/trilogy-libraries/trilogy/pull/47) and assuming that further integration is expected later.) 

Then, I decided to try rewriting using threads.
```ruby
 client = Trilogy.new(host: "127.0.0.1", port: 3306, username: "root", password: "test")
threads = 2.times.map do
  Thread.new do
    res = client.query("SHOW DATABASES")
    puts res
  end
end
threads.map(&:join)
```

But I still encountered the same error.
I thought the client(one TCP socket) should not be shared between threads.

So, I fixed the above code to create a new client per thread:
```ruby
threads = 2.times.map do
  Thread.new do
    # create a new client here
    client = Trilogy.new(host: "127.0.0.1", port: 3306, username: "root", password: "test")
    res = client.query("SHOW DATABASES")
    puts res
  end
end
threads.map(&:join)
```

At first sight, the code does not report any error!

However, if I dump TCP packets using Wireshark, MySQL Server still shows the same error.
```
Frame 39: 121 bytes on wire (968 bits), 121 bytes captured (968 bits) on interface lo, id 0
Ethernet II, Src: 00:00:00_00:00:00 (00:00:00:00:00:00), Dst: 00:00:00_00:00:00 (00:00:00:00:00:00)
Internet Protocol Version 4, Src: 127.0.0.1, Dst: 127.0.0.1
Transmission Control Protocol, Src Port: 3306, Dst Port: 37856, Seq: 285, Ack: 141, Len: 55
MySQL Protocol - response ERROR
    Packet Length: 51
    Packet Number: 0
    Response Code: ERR Packet (0xff)
    Error Code: 1158
    SQL state: 08S01
    Error message: Got an error reading communication packets

```
![Снимок экрана_2023-10-14_09-28-50](https://github.com/trilogy-libraries/trilogy/assets/100127291/a167b3c0-f4de-4240-a104-c6c868bb85d5)

Is this an expected behavior? Or maybe did I write something the wrong codes...?
If so, please close this issue, and sorry for taking your time.

Thank you for your time.

```
❯ uname -a
Linux kali 6.5.0-rc6-linux-surface #9 SMP PREEMPT_DYNAMIC Wed Aug 16 14:49:51 MSK 2023 x86_64 GNU/Linux

❯ ruby -v
ruby 3.3.0dev (2023-10-05T04:19:09Z master a472fd55da) [x86_64-linux]

# Gemfile
gem "trilogy", "~> 2.6"
```

**Comment by jhawthorn** [comment]
This is expected, if you want multiple parallel queries you will need multiple parallel clients, or if you want to block on the same client until it is ready you should bring your own mutex to ensure only one query runs at a time.

I think we'd like to make this error nicer/more obvious (some error indicating that parallel usage of a client is invalid) but I haven't found the right way to do it yet that doesn't cause other downsides.
